{
  "horn": "0.2",
  "sources": [
    {
      "id": "horn_cloning_example",
      "title": "The Cloning Debate — Who Says What and Why?",
      "author": "Robert E. Horn",
      "year": 2003,
      "note": "Clean-room semantic fixture derived from the handbook example; not a facsimile."
    }
  ],
  "passages": [
    {
      "id": "p_focus_support",
      "source": "horn_cloning_example",
      "locator": "handbook example, terminology map",
      "text": "The example distinguishes the intended outcomes and ethical implications of nuclear transplantation from reproductive cloning."
    },
    {
      "id": "p_dispute",
      "source": "horn_cloning_example",
      "locator": "handbook example, terminology map",
      "text": "The counter-position argues that the shared procedure and the possibility of enabling reproductive cloning justify retaining cloning terminology."
    }
  ],
  "debates": [
    {
      "id": "cloning_terminology",
      "issue": {
        "id": "i_cloning_term",
        "type": "terminology",
        "question": "Should somatic cell nuclear transfer for embryonic stem-cell research be called nuclear transplantation rather than therapeutic cloning?"
      },
      "focus": "c_nuclear_transplantation",
      "claims": [
        {
          "id": "c_nuclear_transplantation",
          "text": "Somatic cell nuclear transfer for embryonic stem-cell research should be called nuclear transplantation.",
          "role": "position",
          "derivation": "summarized",
          "editorial_state": "publishable",
          "evidence_state": "grounded",
          "evidence": [
            "p_focus_support"
          ]
        },
        {
          "id": "c_different_end_products",
          "text": "Nuclear transplantation and reproductive cloning have materially different intended end products.",
          "derivation": "summarized",
          "editorial_state": "publishable",
          "evidence_state": "grounded",
          "evidence": [
            "p_focus_support"
          ]
        },
        {
          "id": "c_term_matches_process_and_goal",
          "text": "The term nuclear transplantation describes both movement of nuclear material and the regenerative-medicine objective.",
          "derivation": "summarized",
          "editorial_state": "publishable",
          "evidence_state": "grounded",
          "evidence": [
            "p_focus_support"
          ]
        },
        {
          "id": "c_ethics_differ",
          "text": "The ethical implications of nuclear transplantation differ from those of reproductive cloning.",
          "derivation": "summarized",
          "editorial_state": "publishable",
          "evidence_state": "grounded",
          "evidence": [
            "p_focus_support"
          ]
        },
        {
          "id": "c_cloning_term_confuses_policy",
          "text": "Using cloning terminology can confuse policy makers and the public about the distinction between reproductive cloning and nuclear transplantation.",
          "derivation": "summarized",
          "editorial_state": "publishable",
          "evidence_state": "grounded",
          "evidence": [
            "p_focus_support"
          ]
        },
        {
          "id": "c_shared_process_supports_cloning_term",
          "text": "Because the same basic transfer process can contribute to reproductive cloning, the cloning label remains defensible.",
          "role": "rebuttal",
          "derivation": "summarized",
          "editorial_state": "publishable",
          "evidence_state": "grounded",
          "evidence": [
            "p_dispute"
          ]
        }
      ],
      "relations": [
        {
          "kind": "supports",
          "from": "c_cloning_term_confuses_policy",
          "to": "c_nuclear_transplantation"
        },
        {
          "kind": "supports",
          "from": "c_different_end_products",
          "to": "c_cloning_term_confuses_policy"
        },
        {
          "kind": "supports",
          "from": "c_term_matches_process_and_goal",
          "to": "c_cloning_term_confuses_policy"
        },
        {
          "kind": "supports",
          "from": "c_ethics_differ",
          "to": "c_cloning_term_confuses_policy"
        },
        {
          "kind": "disputes",
          "from": "c_shared_process_supports_cloning_term",
          "to": "c_nuclear_transplantation"
        }
      ],
      "streams": [
        {
          "id": "s_terminology_fit",
          "claims": [
            "c_nuclear_transplantation",
            "c_cloning_term_confuses_policy",
            "c_different_end_products",
            "c_term_matches_process_and_goal",
            "c_ethics_differ"
          ]
        },
        {
          "id": "s_shared_process_rebuttal",
          "claims": [
            "c_nuclear_transplantation",
            "c_shared_process_supports_cloning_term"
          ]
        }
      ],
      "display": {
        "title_mode": "title_is_claim"
      }
    }
  ]
}
